date,source_name,source_type,headline,snippet,url,geography,geography_refs,geography_matches,issue_area,source_platform,subreddit,score,num_comments,relevance_score,issue_keyword_matches,language,collection_failures,rows_before_filtering,rows_after_filtering
2026-05-25,r/nyc,public Reddit discussion,Marine Corps aircraft landing at helipad 9 in Fidi,They were there for 5-10 mins then took off again. Several others in the area as well.,https://www.reddit.com/r/nyc/comments/1tnmtks/marine_corps_aircraft_landing_at_helipad_9_in_fidi/,NYC,NYC,NYC,AI / tech jobs,reddit,nyc,48,24,3,AI,English,,1224,721
2026-05-25,r/Albany,public Reddit discussion,Albany Rural Cemetery not opened until noon on Memorial Day!,"I decided to swing by Albany Rural Cemetery with a friend today against my better judgment.

At 9:30, the gates were still closed at both entrance.  There was a group of men in uniform who (I think) were supposed to do a ceremony there and a lot of vets.

We went next door to St. Agnes to pass the time since I’ve got an aunt and uncle there, too.

At noon, Albany Rural gates were still locked.

Someone got sick of wa",https://www.reddit.com/r/Albany/comments/1tnjjnq/albany_rural_cemetery_not_opened_until_noon_on/,Capital Region,Capital Region,Capital Region,AI / tech jobs,reddit,Albany,21,3,5,AI,English,,1224,721
2026-05-25,r/Syracuse,public Reddit discussion,"Collingwood Block Sale — 10+ Homes, Vintage Finds, Furniture, Clothing &amp; More! (May 29–30)","Hey Syracuse! 👋

The 300 block of N. Collingwood Ave is hosting a HUGE neighborhood block sale on Friday &amp; Saturday, May 29–30 from 9AM–3PM.

We’ll have 10+ homes participating with a ton of different stuff including:

Vintage finds  
Furniture  
Clothing  
Household goods  
Toys &amp; kids items  
Home décor  
Collectibles  
Free items at select homes  
Hidden gems &amp; random treasures

If you love garage sale",https://www.reddit.com/r/Syracuse/comments/1tnc8yi/collingwood_block_sale_10_homes_vintage_finds/,Central NY,Central NY,Central NY,housing / rent,reddit,Syracuse,2,4,3,"rent, AI",English,,1224,721
2026-05-25,r/Syracuse,public Reddit discussion,Migraine lenses? FL-41? Red glasses?,"Hello! I am wondering if anyone knows of any eye doctors/optometrists/glasses stores that can do FL-41 lenses, or really any place that can tint the color of the lenses red to help with migraines. I know VisionWorks doesn’t do it, which is the only eye doctor I’ve been to in the area.   
Any suggestions would be greatly appreciated!",https://www.reddit.com/r/Syracuse/comments/1tna0t3/migraine_lenses_fl41_red_glasses/,Central NY,Central NY,Central NY,AI / tech jobs,reddit,Syracuse,0,5,3,AI,English,,1224,721
2026-05-25,r/Syracuse,public Reddit discussion,Weekly Syracuse Roundup: Trader Joe's Is Coming to Camillus and Constellation Energy just landed $30M,"Happy Memorial Day weekend, r/Syracuse!

This week: CNY is getting a second Trader Joe's, a cement mixer reminded us all that the Parkway Bridge has a height limit, Constellation Energy just landed $30M to pursue a new nuclear reactor in Oswego County, and there's a CNY company quietly making the wire inside 80% of all guitar strings sold in the U.S. (yes, really).

[Full edition here](https://www.tldrsyracuse.com/p/",https://www.reddit.com/r/Syracuse/comments/1tn56z8/weekly_syracuse_roundup_trader_joes_is_coming_to/,Central NY,Central NY,Central NY,housing / rent,reddit,Syracuse,96,18,5,"rent, AI",English,,1224,721
2026-05-25,r/Syracuse,public Reddit discussion,Fishing for young ones?,"Hello all, 

You're always helpful and encouraging with your recommendations I have received. 

Have two young kids, 4 and coming up on 3.

Was looking for some recommendations to take them fishing. Nothing crazy of course, bluegill, perch, some sunnies. Would like them to have a good chance at catching their first fish!

I haven't been out in many years, but mainly only have fished for trout in the past.. We'll work",https://www.reddit.com/r/Syracuse/comments/1tmvdu6/fishing_for_young_ones/,Central NY,Central NY,Central NY,AI / tech jobs,reddit,Syracuse,9,16,2,AI,English,,1224,721
2026-05-25,r/Syracuse,public Reddit discussion,Randolph House Hotel a Trademark Collection by Wyndham Liverpool/Syracuse or quality Inn East Carrier Syracuse debating between those 2 hotels for the state fair? Which hotel would you recommend? Thanks in advance,Randolph House Hotel or Quality inn east Syracuse Carrier Circle?,https://www.reddit.com/r/Syracuse/comments/1tmuvlf/randolph_house_hotel_a_trademark_collection_by/,Central NY,Central NY,Central NY,AI / tech jobs,reddit,Syracuse,0,6,5,AI,English,,1224,721
2026-05-25,r/Syracuse,public Reddit discussion,How close is central square/Brewerton to Syracuse or its surrounding suburbs? What is there to do in the central square/Brewerton area.,Im looking unto the Syracuse area for an apartment or a house. I am getting a job in downtown Syracuse. What is there to do in central square or Brewerton. Is it relatively close to Syracuse? What is living in central square/Brewerton like.,https://www.reddit.com/r/Syracuse/comments/1tmuu1l/how_close_is_central_squarebrewerton_to_syracuse/,Central NY,Central NY,Central NY,,reddit,Syracuse,12,29,4,,English,,1224,721
2026-05-25,r/Syracuse,public Reddit discussion,Does anyone or business in the area do sashiko repairs on raw denim?,Have a pair of raw denim I love with a blow out on the back pocket from my wallet. I like the look of sashiko repairs but I’m too neurotic to do it myself.,https://www.reddit.com/r/Syracuse/comments/1tmuofy/does_anyone_or_business_in_the_area_do_sashiko/,Central NY,Central NY,Central NY,AI / tech jobs,reddit,Syracuse,4,1,3,AI,English,,1224,721
2026-05-25,r/Albany,public Reddit discussion,Where to paddle board?,"I finally bought my own paddle board! Where do you all go for paddle boarding in this area and where do you launch from at that spot? I am used to doing a rental with a designated launch spot. I'm hoping for easy launching and to avoid too much vegetation or too many boats. I've been to Thacher and Lake Lonely, but I would like to explore other spots.",https://www.reddit.com/r/Albany/comments/1tnnloc/where_to_paddle_board/,Capital Region,Capital Region,Capital Region,housing / rent,reddit,Albany,2,3,2,rent,English,,1224,721
2026-05-25,r/Albany,public Reddit discussion,Can I find a decent move in ready home in the surrounding Albany area for 375k or less?,"Pretty much the title, have been looking at homes, put in an offer for 2 and was outbid both times. Not looking for anything crazy just a fairly move in ready home 

Anyone buy or look recently that can give input?",https://www.reddit.com/r/Albany/comments/1tnkizm/can_i_find_a_decent_move_in_ready_home_in_the/,Capital Region,Capital Region,Capital Region,AI / tech jobs,reddit,Albany,0,9,4,AI,English,,1224,721
2026-05-25,r/Albany,public Reddit discussion,Late Night Food Near Empire Live?,"As the title says. One of my girlfriends is visiting in August so we can go see Hollywood Undead and I'm looking for suggestions of places to eat afterwards. Albany is full of good food but post covid it's so hard to find spots that are open late.

Any good spots open after 10, or should we commit ourselves to grab I g some burger king? Thanks",https://www.reddit.com/r/Albany/comments/1tnkiq4/late_night_food_near_empire_live/,Capital Region,Capital Region,Capital Region,,reddit,Albany,4,5,2,,English,,1224,721
2026-05-25,r/newyork,public Reddit discussion,Where would you go on a NYS tour?,"If you were to take two or four weeks and travel around the state, where would you go? 

I’m born and raised here, but haven’t seen all of it. I live in NYC and have spent lots of time on LI, Hudson Valley, White Plains, the Catskills, and the Adirondacks. I’ve been to Niagara Falls, Ithaca, Buffalo, Saratoga, Albany, New Paltz… Have not been to Rochester or Syracuse.",https://www.reddit.com/r/newyork/comments/1tn9nkz/where_would_you_go_on_a_nys_tour/,"NYC, Hudson Valley, Capital Region, Central NY, Western NY","NYC, Hudson Valley, Capital Region, Central NY, Western NY","NYC, Hudson Valley, Capital Region, Central NY, Western NY",AI / tech jobs,reddit,newyork,4,11,3,AI,English,,1224,721
2026-05-25,r/Albany,public Reddit discussion,Owning a boat worth it?,"Hi - I’m interested in buying a boat but want to know the cost of marina/dock fees, storage for winter, yearly maintenance, insurance, and fuel? does anyone have any advice or recommendation?",https://www.reddit.com/r/Albany/comments/1tnk2yk/owning_a_boat_worth_it/,Capital Region,Capital Region,Capital Region,AI / tech jobs,reddit,Albany,0,20,2,AI,English,,1224,721
2026-05-25,r/buffalo,public Reddit discussion,An unfortunate local trend,"If I go into your shop (doesn’t matter Elmwood Strip or the Galleria) and see you selling AI art, I’m probably just gonna leave.

I leave my apartment and get away from my phone to intentionally \*get away\* from that shit; and I’m not even the most anti-AI or anti-data centers person.

Anyone else feel this way or have any experiences?",https://www.reddit.com/r/Buffalo/comments/1tnomat/an_unfortunate_local_trend/,Western NY,Western NY,Western NY,AI / tech jobs,reddit,buffalo,18,2,2,AI,English,,1224,721
2026-05-25,r/Syracuse,public Reddit discussion,Holiday delays for waste removal,"Has anyone developed a resource somewhat like the odd-even parking website to indicate which weeks have city waste removal delayed due to a holiday (on the weekend or during the work week)?

I can't find any info on the city website. I can usually guess right, but I've got about a 10% fail rate and would like to improve my odds!",https://www.reddit.com/r/Syracuse/comments/1tnghrd/holiday_delays_for_waste_removal/,Central NY,Central NY,Central NY,AI / tech jobs,reddit,Syracuse,1,4,2,AI,English,,1224,721
2026-05-25,r/Albany,public Reddit discussion,Where is everyone on the weekends?,"We’re looking at homes in Albany (relocating from a different state) and overall it seems like a nice city. We loved the parks, good Thai food, found a couple of good cafes, people are friendly, etc. We saw a road race go by on Thursday and it was nice to see people of different ages and running abilities participate, and many people sitting on their stoops to watch.

Then Saturday came and suddenly it was super empt",https://www.reddit.com/r/Albany/comments/1tnj4h4/where_is_everyone_on_the_weekends/,Capital Region,Capital Region,Capital Region,housing / rent,reddit,Albany,29,21,3,"rent, AI",English,,1224,721
2026-05-25,r/Albany,public Reddit discussion,Airport arrival.,"What time do people recommend for arrival at Albany airport for 6am flight…asking anyone who has recently flown. Not sure how fast security is at that time. Thx.

\*\*I’m getting dropped off. I am checking a bag. I don’t have any special tsa pass. Thx. And this is tomorrow, Tuesday.",https://www.reddit.com/r/Albany/comments/1tncyha/airport_arrival/,Capital Region,Capital Region,Capital Region,AI / tech jobs,reddit,Albany,2,32,4,AI,English,,1224,721
2026-05-25,r/Albany,public Reddit discussion,Window tinting?,Got a new car that needs tint. Any shop recommendations? Preferably in Albany but I’m willing to drive outside the city.,https://www.reddit.com/r/Albany/comments/1tnbp09/window_tinting/,Capital Region,Capital Region,Capital Region,,reddit,Albany,1,2,2,,English,,1224,721
2026-05-25,r/Albany,public Reddit discussion,Drummer looking for group,"Drummer looking to join or start an alternative, shoegaze, post-hardcore, or  jangle/dreamy rock project or some blend thereof. I'm in the Capitol District (Troy) but am willing to commute some for the right project.

Inspirations are Hum, Slowdive, Circa Survive, Saosin,  Glimmer, She's Green, Greet Death, Turnover, Alvvays, 

I have my own gear and both live and recording experience.

DM me!",https://www.reddit.com/r/Albany/comments/1tnax8o/drummer_looking_for_group/,Capital Region,Capital Region,Capital Region,,reddit,Albany,4,5,2,,English,,1224,721
2026-05-25,r/Albany,public Reddit discussion,Friday in Troy: house music with Brooklyn DJ Derek Russo,"https://preview.redd.it/25o5dgrvma3h1.png?width=1080&amp;format=png&amp;auto=webp&amp;s=0b0bf7ed475ba04184df817e507486192c1ff46e

lowercase pres. MOVE YOU | an underground dance party at The Waiting Room in Troy, NY. For this special edition we are excited to welcome Brooklyn-based deejay, producer, promoter &amp; educator, Derek Russo. Derek is lauded for his ability to adapt seamlessly to most any type of gig while",https://www.reddit.com/r/Albany/comments/1tnath2/friday_in_troy_house_music_with_brooklyn_dj_derek/,"NYC, Capital Region","NYC, Capital Region","NYC, Capital Region",AI / tech jobs,reddit,Albany,14,0,5,AI,English,,1224,721
2026-05-25,r/Albany,public Reddit discussion,What are our regional ‘gems’?,"A while back there was a post on r/howisitlivingthere asking about Albany and mentioning the underwhelming food scene. And in response I had to concede but also mentioned that we have a few “gems” in the city and region as well. 

Like if someone’s coming through and asks about food, I’ll reflexively recommend Ragonese for sandwiches. And the post this AM about Thacher made me think about the Park and Indian Ladder -",https://www.reddit.com/r/Albany/comments/1tn9vij/what_are_our_regional_gems/,Capital Region,Capital Region,Capital Region,AI / tech jobs,reddit,Albany,124,62,3,AI,English,,1224,721
2026-05-25,r/Albany,public Reddit discussion,New Business in Albany,"I know someone asked this question already but what new business would you want to see in Albany or the Capital Region. It can be anything that comes to your mind (no bad ideas)

Edit: Come on people I see a bunch of people viewing and not many commenting. No idea is a bad idea!!",https://www.reddit.com/r/Albany/comments/1tn9a5d/new_business_in_albany/,Capital Region,Capital Region,Capital Region,,reddit,Albany,12,158,4,,English,,1224,721
2026-05-25,r/Albany,public Reddit discussion,Parents who chose Bethlehem or Voorheesville — what made you choose?,"My family is considering Bethlehem vs Voorheesville long term. We’ve looked at rankings, but I’d love real experiences from parents — school culture, class sizes, extracurriculars, community feel, and overall day-to-day life.",https://www.reddit.com/r/Albany/comments/1tn94hz/parents_who_chose_bethlehem_or_voorheesville_what/,Capital Region,Capital Region,Capital Region,housing / rent,reddit,Albany,2,2,3,rent,English,,1224,721
2026-05-25,r/Albany,public Reddit discussion,Hydroplaning,"Just wanted to tell everyone that the highways are \*insane\* this morning.

Seriously, be careful. Rain doesn’t seem like much, but I’ve never hydroplaned as much as today.  
I’m not exaggerating when I say it happened about a dozen times on my way to Saratoga.

On the way back I saw a single car crash, several flips. No idea if they’re ok. One cop &amp; no people visible beside the upside down car.  
I wouldn’t mak",https://www.reddit.com/r/Albany/comments/1tn6bud/hydroplaning/,"NYC, Capital Region","NYC, Capital Region","NYC, Capital Region",housing / rent,reddit,Albany,103,47,3,"rent, AI",English,,1224,721
2026-05-25,r/Albany,public Reddit discussion,Local hospice experiences?,"Might be putting my dad on hospice this week, late stage Alzheimer's. He's currently at a hospital refusing to eat or take meds. 

Can anyone share your experiences with local hospice providers? Did your loved one do hospice at home or in a facility? If at home, did you hire private home care workers for the periods between visits?

This is a gentle, loving man with a lifelong history of severe depression and trauma.",https://www.reddit.com/r/Albany/comments/1tn66mc/local_hospice_experiences/,Capital Region,Capital Region,Capital Region,housing / rent,reddit,Albany,17,19,2,rent,English,,1224,721
2026-05-25,r/Albany,public Reddit discussion,Ska Punk band looking for 1 or 2 more horns! Plus building a Discord community!,"Checkered Noize, a 518/Latham based ska punk band, is looking for 1 or 2 more horns to round out the line up! Really aiming for a baritone sax, but would also very much love a trombone! 

Currently have a trumpet and alto sax in the horn section, as well as lead and backing vocals, drums, rhythm, lead, and bass guitars, and possibly keyboard, in the rest of the lineup.

Primarily practice in Latham, but have alternat",https://www.reddit.com/r/Albany/comments/1tn5ozl/ska_punk_band_looking_for_1_or_2_more_horns_plus/,Capital Region,Capital Region,Capital Region,housing / rent,reddit,Albany,17,5,2,"rent, AI",English,,1224,721
2026-05-25,r/Albany,public Reddit discussion,Did you lose a wallet recently?,"Hello Albany!

I work at Herbies Burgers on Lark, and we recently found a wallet. It's been a few days, so I decided to post to see if we could get the word out. 

I'm just trying to find the male who lost his wallet and other important documents. 

I know you're 19 years old and thinking how much the shit sucks, but we have it waiting for you to come collect. 

Your name is Kevin, but you seem to sign it differently",https://www.reddit.com/r/Albany/comments/1tn2oqo/did_you_lose_a_wallet_recently/,Capital Region,Capital Region,Capital Region,housing / rent,reddit,Albany,30,5,3,"rent, AI",English,,1224,721
2026-05-25,r/Syracuse,public Reddit discussion,Best public park in Syracuse for a kids party?,Looking to save a little money. Any suggestions?,https://www.reddit.com/r/Syracuse/comments/1tnfhee/best_public_park_in_syracuse_for_a_kids_party/,Central NY,Central NY,Central NY,,reddit,Syracuse,2,6,3,,English,,1224,721
2026-05-25,r/Syracuse,public Reddit discussion,Events happening in CNY this Wednesday,Anyone know of any events happening in Central New York this Wednesday? I am a reporter from NCC News out of Syracuse and looking for timely events going on this week. Looking for multiples sources to speak to in person. This would be turned into a story to be aired on the 4pm newscast on NCC News. Any ideas and sources would be greatly appreciated!,https://www.reddit.com/r/Syracuse/comments/1tnhg0e/events_happening_in_cny_this_wednesday/,Central NY,Central NY,Central NY,AI / tech jobs,reddit,Syracuse,0,0,3,AI,English,,1224,721
2026-05-25,r/Albany,public Reddit discussion,Tailor for men’s suits,Hi All! I’m just wondering if anyone has any good recommendations for a great tailor specifically for men’s suits. Extra points if you can provide an idea what you paid for pants and jacket tailoring. Thank you!,https://www.reddit.com/r/Albany/comments/1tmsja8/tailor_for_mens_suits/,Capital Region,Capital Region,Capital Region,AI / tech jobs,reddit,Albany,6,11,3,AI,English,,1224,721
2026-05-25,r/Rochester,public Reddit discussion,Looking for teaching jobs,Hello everyone! Ill be moving to rochester pretty soon. I just completed my first year of teaching and I have my initial certification in childhood education 1-6. I dont have my masters yet.  What is the best way to get my foot in the door? Where should I work if I want to make the most money? Any ideas would be helpful! Thank you!,https://www.reddit.com/r/Rochester/comments/1tne570/looking_for_teaching_jobs/,Western NY,Western NY,Western NY,,reddit,Rochester,0,15,2,,English,,1224,721
2026-05-25,r/buffalo,public Reddit discussion,How is the roommate situation right now?,"I'm currently around the Colden area and being this far from society is actually having serious effects on my mental health. The only reason I'm here is there are some limiting factors keeping me here that I need to get through first before I go anywhere. 

But I'm so desperate right now to get out, I was wondering how the roommate economy is going? Now that it's 2026 and everybodies poor, there's gotta be more optio",https://www.reddit.com/r/Buffalo/comments/1tnezoz/how_is_the_roommate_situation_right_now/,Western NY,Western NY,Western NY,housing / rent,reddit,buffalo,4,4,2,rent,English,,1224,721
2026-05-25,r/buffalo,public Reddit discussion,Cheapest digital-only subscription for the Buffalo News.,Mine recently expired at $52/year. Wondering what deals people recently were able to get and how. Thanks!,https://www.reddit.com/r/Buffalo/comments/1tnb3lv/cheapest_digitalonly_subscription_for_the_buffalo/,Western NY,Western NY,Western NY,,reddit,buffalo,0,3,3,,English,,1224,721
2026-05-25,r/buffalo,public Reddit discussion,This seasons Flow Jam kicks off today! (Free event),"Sahlens graciously donated 90 pounds of hot dogs for today’s event. Free to anyone who wants some! Feel free to bring a dish to share for today’s potluck cookout if you can. 

Music starts at 7pm and goes until 10. Witty Tarbox has the honors of kicking off this season of Flow Jam. We will be down there before then enjoying the sunshine. 

Hoyt Lake at Delaware Park. 

Let’s go Buffalo! Happy Memorial Day!",https://www.reddit.com/r/Buffalo/comments/1tna42h/this_seasons_flow_jam_kicks_off_today_free_event/,Western NY,Western NY,Western NY,,reddit,buffalo,14,2,2,,English,,1224,721
2026-05-25,r/buffalo,public Reddit discussion,Stained glass tools/materials around WNY?,"Hey everyone, I'm looking for recommendations on where to find stained glass supplies and equipment in the Buffalo area.

​Aside from ordering everything brand new online, are there any local glass studios, estate sale networks, or hidden gems where you can reliably find used studio gear (like grinders or saws) or leftover glass sheets? I've started teaching small beginner classes and would love to find ways to give ",https://www.reddit.com/r/Buffalo/comments/1tn5sfh/stained_glass_toolsmaterials_around_wny/,Western NY,Western NY,Western NY,AI / tech jobs,reddit,buffalo,10,11,4,AI,English,,1224,721
2026-05-25,r/buffalo,public Reddit discussion,Great horned owl in North Buffalo?,Anyone else hear the owl this morning in North Buffalo? I own property just south of Franklinville and hear them all the time down there. This morning was the first time I’ve heard them at home. In the North Park area.,https://www.reddit.com/r/Buffalo/comments/1tn4tba/great_horned_owl_in_north_buffalo/,Western NY,Western NY,Western NY,,reddit,buffalo,47,20,4,,English,,1224,721
2026-05-25,r/buffalo,public Reddit discussion,21st celebration,My younger cousin (21F) is coming up to Buffalo she's from a very small town and wants to celebrate her 21st and I want to make it special for her. She's here for a Friday and Saturday night... any suggestions on what to do? I was thinking Elmwood one day and Chippewa another.... what night would be best for each place? Do you have any better ideas? I'll take any suggestions cause I don't go out much so I need help p,https://www.reddit.com/r/Buffalo/comments/1tmvsaj/21st_celebration/,Western NY,Western NY,Western NY,AI / tech jobs,reddit,buffalo,1,6,3,AI,English,,1224,721
2026-05-25,r/buffalo,public Reddit discussion,Vintage purse repair/restoration recommendations?,"My mom recently just moved and as she was going through her closet we found some old handbags of hers. She offered them to me but they’re in pretty rough shape. I decided to keep two of them, both luxury purses. But they are in pretty rough shape. The straps are deteriorating and the body of the purse is in tact but just rough looking and missing some hardware. These bags have to be at least thirty years old. I was w",https://www.reddit.com/r/Buffalo/comments/1tmtyfb/vintage_purse_repairrestoration_recommendations/,Western NY,Western NY,Western NY,AI / tech jobs,reddit,buffalo,3,1,2,AI,English,,1224,721
2026-05-25,r/buffalo,public Reddit discussion,Buffalo shirt for toddler,You know those cliche onesies/shirts that say my auntie in NY loves me or whatever state? I want a toddler shirt that says “my auntie in Buffalo loves me” with a Buffalo symbol. I don’t wanna scour the internet forever so I’m hoping to find someone local that could do this for me.,https://www.reddit.com/r/Buffalo/comments/1tmthuk/buffalo_shirt_for_toddler/,Western NY,Western NY,Western NY,,reddit,buffalo,0,3,4,,English,,1224,721
2026-05-25,r/Rochester,public Reddit discussion,What’s the nicest McDonald’s in Rochester and surrounding suburbs?,Reddit discussion link: https://www.reddit.com/r/Rochester/comments/1tnnxqb/whats_the_nicest_mcdonalds_in_rochester_and/,https://www.reddit.com/r/Rochester/comments/1tnnxqb/whats_the_nicest_mcdonalds_in_rochester_and/,Western NY,Western NY,Western NY,,reddit,Rochester,3,15,3,,English,,1224,721
2026-05-25,r/Rochester,public Reddit discussion,Cat rehoming,"Hello, I currently live in a really abusive household, planning on moving out by the end of this week. I have a cat that needs a new home, unfortunately I can’t take him with me. He’s a very good cat. Super cuddly, does well with other cats. Would not do good in a home with dogs just because he was also abused in this house as well. He’s an all black cat named shadow. He is fixed and has all his shots from what I am ",https://www.reddit.com/r/Rochester/comments/1tnjywr/cat_rehoming/,Western NY,Western NY,Western NY,housing / rent,reddit,Rochester,19,6,2,rent,English,,1224,721
2026-05-25,r/Rochester,public Reddit discussion,Cards and collectibles,"I have a full deck of 1981 Rochester red wings cards with a Cal Ripken in it. Is there a place locally I can get it valued at? It’s still in its original packaging and not sure if I want to open it. I looked at a place in Texas that rates the cards but you have to open the packaging, send them the card then they send it back. I was told to insure it but I’m not even sure what the it’s worth. I’ve looked on eBay and i",https://www.reddit.com/r/Rochester/comments/1tnjgo3/cards_and_collectibles/,Western NY,Western NY,Western NY,AI / tech jobs,reddit,Rochester,3,8,3,AI,English,,1224,721
