date,source_name,source_type,headline,snippet,url,geography,geography_refs,geography_matches,issue_area,source_platform,subreddit,score,num_comments,relevance_score,issue_keyword_matches,language,collection_failures,rows_before_filtering,rows_after_filtering
2026-05-22,r/AskNYC,public Reddit discussion,Found someone on Craigslist subletting an apartment the owner says can't be sublet — what should OP do now?,"Looking for some Reddit wisdom on a situation I ran into.

Was browsing Craigslist for a room and came across a listing for a 4-bedroom apartment where the poster — describing himself as a musician — was advertising two of the rooms for rent. On paper everything looked fine: decent photos, reasonable price, friendly tone. But something about it just didn't sit right with me. Call it gut feeling, call it pattern recog",https://www.reddit.com/r/AskNYC/comments/1tk8g23/found_someone_on_craigslist_subletting_an/,NYC,NYC,NYC,housing / rent,reddit,AskNYC,0,4,3,"rent, housing, landlord, AI",English,,1224,721
2026-05-22,r/AskNYC,public Reddit discussion,how to deal with the rat problem??,This is so beyond embarrassing. I am a teen and my parents and I have moved in to the second floor of a house two year ago. The landlords live downstairs and they have been dealing with rat problems and so have we. Somehow we managed to get it under control for a while but now it's gotten so bad again. I'm not even sure how much are even in our small little house but it's well over 3. I am an organized person and I l,https://www.reddit.com/r/AskNYC/comments/1tk8phh/how_to_deal_with_the_rat_problem/,NYC,NYC,NYC,housing / rent,reddit,AskNYC,32,27,2,"rent, landlord, AI",English,,1224,721
2026-05-22,r/AskNYC,public Reddit discussion,Looking for the best rentable office space in Bryant Park,"Hi! I own a creative design studio. There are two principle designers and we have a part time junior designer so I’m looking for an office I can rent that’s affordable for three people with space for three - desks and a meeting table and some storage. Would love to be within a larger office, I don’t care if it’s tech or finance or a coworking space. I’m happy to trade design services for space in your office as well.",https://www.reddit.com/r/AskNYC/comments/1tklvko/looking_for_the_best_rentable_office_space_in/,NYC,NYC,NYC,housing / rent,reddit,AskNYC,2,7,3,rent,English,,1224,721
2026-05-22,r/AskNYC,public Reddit discussion,Push back on rent increase after boiler went out in winter?,"Like the title says: My lease is up in September and I want to stay in my place. My current lease is 2-years. They increased my rent based on the allowed percentage for rent stabilized places - but the last two winters one of the two boilers went out - which meant no heat in my apartment for more than a week.

I have receipts from this most recent winter (pictures of my in-home thermometer and emails/texts to super/m",https://www.reddit.com/r/AskNYC/comments/1tkm8z8/push_back_on_rent_increase_after_boiler_went_out/,NYC,NYC,NYC,housing / rent,reddit,AskNYC,0,6,3,"rent, AI",English,,1224,721
2026-05-22,r/longisland,public Reddit discussion,Air show/Drone show Jones beach,Anyone know what’s going on with this? There’s no air show this weekend but a drone show instead? Also I’m assuming you can’t do a drone show in the rain. Is the air show now 4th of July weekend?,https://www.reddit.com/r/longisland/comments/1tkhjvc/air_showdrone_show_jones_beach/,Long Island,Long Island,Long Island,AI / tech jobs,reddit,longisland,5,9,3,AI,English,,1224,721
2026-05-22,r/AskNYC,public Reddit discussion,Applied for one shot deal,"Hi all, fell behind on a $14k rent arrear and went ahead and applied for the one-shot deal in order to resolve this and avoid any further eviction proceedings.

Applied on May 20th and got my interview on May 21st after calling several times. Interview took about 30 to 40 mins with a nice enployee just asking questions and towards the end of the call, he mentioned I’d hear back again from someone for follow up but th",https://www.reddit.com/r/AskNYC/comments/1tkobvl/applied_for_one_shot_deal/,NYC,NYC,NYC,housing / rent,reddit,AskNYC,6,1,2,"rent, eviction, AI",English,,1224,721
2026-05-22,r/longisland,public Reddit discussion,Beach access with dogs,I was talking to a real estate attorney who is retired and does a lot of walking with his wife. He lives in Southampton and it seems that a lot of associations and residentials have blocked former areas where there was always access to the beach and the waterways. He said that no private property owner can all of a sudden decide to deny access to the beach area of the waterway where you walk. I’ve had that problem al,https://www.reddit.com/r/longisland/comments/1tkjmi6/beach_access_with_dogs/,Long Island,Long Island,Long Island,AI / tech jobs,reddit,longisland,19,32,2,AI,English,,1224,721
2026-05-22,r/longisland,public Reddit discussion,Experience with Amityville Schools?,"Hello,

I have been renting in the Village of Amityville for several years. My wife and I have had an extremely positive experience. We have met many very nice folks and we frequently patronize a lot of the businesses downtown. We have found it to be very safe and we have dealt with the police for a non-emergency and they were very responsive and friendly. We are thinking of buying a home in the Village and I am look",https://www.reddit.com/r/longisland/comments/1tkjoqh/experience_with_amityville_schools/,Long Island,Long Island,Long Island,housing / rent,reddit,longisland,12,40,3,rent,English,,1224,721
2026-05-22,r/longisland,public Reddit discussion,"Me and wife pay $8,000 a year for just 3 day commute from syosset to Penn station","32M, We rent in syosset and work in the city (hybrid). We did the math, we are paying 8 grand between both of us, just to work in the city 3 days a week. This has me livid I think I need to either move or find a job on the island. This is insane. Disgrace.",https://www.reddit.com/r/longisland/comments/1tkk3el/me_and_wife_pay_8000_a_year_for_just_3_day/,Long Island,Long Island,Long Island,housing / rent,reddit,longisland,347,371,2,rent,English,,1224,721
2026-05-22,r/longisland,public Reddit discussion,ISO Toddler Hats,hi! im a preschool teacher and looking to bulk order toddler baseball cap hats for an end of the year present! any teachers/party planners/parents on here know where I can find a good pair for 10 two year olds? thanks in advance!,https://www.reddit.com/r/longisland/comments/1tkr00e/iso_toddler_hats/,Long Island,Long Island,Long Island,housing / rent,reddit,longisland,1,0,2,"rent, AI",English,,1224,721
2026-05-21,r/Syracuse,public Reddit discussion,Recommendations for Doctors Who Deliver Out of Crouse or Upstate?,"Hello! I am pregnant with my second but am looking for a new doctor this time around. We loved our delivery experience at Upstate Community.. minor complaints about our three day stay there but overall happy with the care we received! 

In my search for a new doctor, I am running into a lot of doctors who deliver at the ‘other’ hospital which I would prefer not to go to. Are there any (female) doctors that you had a ",https://www.reddit.com/r/Syracuse/comments/1tk1bmp/recommendations_for_doctors_who_deliver_out_of/,Central NY,Central NY,Central NY,AI / tech jobs,reddit,Syracuse,9,24,2,AI,English,,1224,721
2026-05-21,r/Syracuse,public Reddit discussion,Cyclomedia mapping car sightings,"I've spotted this car (whether it's the same car or members of a fleet, idk) several times in different locations in Onondaga County over the past few weeks. I did some light googling and Wikipedia says it's from a street-level panoramic mapping company whose products are not available to the public (unlike, for instance, Google Maps).

Does anyone know what they're doing around here? Who's contracting them and what ",https://www.reddit.com/r/Syracuse/comments/1tjwqft/cyclomedia_mapping_car_sightings/,Central NY,Central NY,Central NY,housing / rent,reddit,Syracuse,1,9,2,"rent, AI",English,,1224,721
2026-05-21,r/Syracuse,public Reddit discussion,LM social Shutdown Now?,So a sign is posted on the window saying Closed and a gentleman standing outside  said the city shut her down? Anyone know why? Just came by to have a drink so now we sit a crooked cattle. It’s awfully nice in here btw!,https://www.reddit.com/r/Syracuse/comments/1tjze3k/lm_social_shutdown_now/,Central NY,Central NY,Central NY,AI / tech jobs,reddit,Syracuse,50,81,2,AI,English,,1224,721
2026-05-21,r/Syracuse,public Reddit discussion,City auditor says Syracuse needs to speed up process to build new animal shelter,Reddit discussion link: https://www.waer.org/news/2026-05-21/city-auditor-says-syracuse-needs-to-speed-up-process-to-build-new-animal-shelter,https://www.reddit.com/r/Syracuse/comments/1tjzi5q/city_auditor_says_syracuse_needs_to_speed_up/,Central NY,Central NY,Central NY,,reddit,Syracuse,17,1,3,,English,,1224,721
2026-05-21,r/Syracuse,public Reddit discussion,Democratic lawmakers pushing rent stabilization upstate with the REST Act,Reddit discussion link: https://www.news10.com/capitol/rest-act-upstate-rent-stabilization/,https://www.reddit.com/r/Syracuse/comments/1tjzonb/democratic_lawmakers_pushing_rent_stabilization/,Central NY,Central NY,Central NY,housing / rent,reddit,Syracuse,17,4,2,rent,English,,1224,721
2026-05-21,r/AskNYC,public Reddit discussion,NYC rent stabilized lease corrected downward after years. Other tenants got reimbursements but we haven’t heard anything,"A few years ago, my partner and I moved into an apartment owned by someone who was very close to our family. We signed a lease and paid rent consistently for several years in nyc.

Location: NYC

Recently, after the owner passed away, attorneys/property management reviewed the building paperwork and discovered multiple units are rent stabilized and apparently some registrations/paperwork were not handled correctly fo",https://www.reddit.com/r/AskNYC/comments/1tj7mfk/nyc_rent_stabilized_lease_corrected_downward/,NYC,NYC,NYC,housing / rent,reddit,AskNYC,5,9,6,"rent, AI",English,,1224,721
2026-05-21,r/buffalo,public Reddit discussion,Central Air Installation Prices,"Has anyone installed central air recently? Trying to get an idea of what prices I should realistically expect in 2026. For context, it’s a typical North Buffalo upper/lower duplex and both units already have existing forced air ductwork, so I wouldn’t need brand new ducts installed. Roughly 1,385 sq ft per unit. What did you pay, what size system did you go with, and who did you use? Also curious if there were any un",https://www.reddit.com/r/Buffalo/comments/1tj8lx1/central_air_installation_prices/,Western NY,Western NY,Western NY,AI / tech jobs,reddit,buffalo,2,10,4,AI,English,,1224,721
2026-05-21,r/buffalo,public Reddit discussion,Queer Comedy Buffalo!,"Info from Sunny’s post in the ROC subreddit:

[Sunny Laprade](https://www.instagram.com/sunnylcomedy/) is a queer comic from WNY, currently touring the country with “fellow hilarious gay hottie [Emma Dalenberg.”](https://www.instagram.com/emmadcomedy/)

“We are doing 3 shows in the area next week, and they will be a rip roaring 90 minutes full of queer joy, laughter, and general awesomeness.   
I would love to pack o",https://www.reddit.com/r/Buffalo/comments/1tj7hjd/queer_comedy_buffalo/,Western NY,Western NY,Western NY,housing / rent,reddit,buffalo,5,0,5,rent,English,,1224,721
2026-05-21,r/buffalo,public Reddit discussion,The intersection of Delaware and W. Delavan,It's a sad sight. Blush nightclub - closed. Gas station - closed. Rite aid - closed. Liquor store - closed. But Hutch's is right there. Driving through here headed North or South on Delaware is a weird experience. Anyone know if there is any plan by the city to update the area?,https://www.reddit.com/r/Buffalo/comments/1tj5ep7/the_intersection_of_delaware_and_w_delavan/,Western NY,Western NY,Western NY,AI / tech jobs,reddit,buffalo,97,53,2,AI,English,,1224,721
2026-05-21,r/Syracuse,public Reddit discussion,New York budget restricts local police cooperation with ICE,Reddit discussion link: https://www.news10.com/news/crime/budget-bans-local-ice-contracts/,https://www.reddit.com/r/Syracuse/comments/1tjtoh2/new_york_budget_restricts_local_police/,Central NY,Central NY,Central NY,,reddit,Syracuse,59,16,3,,English,,1224,721
2026-05-21,r/Syracuse,public Reddit discussion,"Mini Job Fair Wednesday, May 27th 10:00 - 1:00 at CNY Works, 960 James Street","\*\*\*\*\*SUNY Upstate, NYS Department of Corrections, NYS Department of Transportation, Page Trucking, and Rescue Mission will also be in attendance.\*\*\*\*\*

Free parking in back of building.  Upon entering, conference rooms with signage to immediate right.   

Entry level to advanced positions.   All are welcome!",https://www.reddit.com/r/Syracuse/comments/1tjvq6t/mini_job_fair_wednesday_may_27th_1000_100_at_cny/,Central NY,Central NY,Central NY,AI / tech jobs,reddit,Syracuse,11,0,2,AI,English,,1224,721
2026-05-21,r/Syracuse,public Reddit discussion,Best food in Syracuse,"Looking for some grub to grab for lunch as I’m passing through 

I like anything and everything

So don’t be picky thinking I won’t like it. Been a while since I’ve been In cuse and want some great eats",https://www.reddit.com/r/Syracuse/comments/1tjmkg0/best_food_in_syracuse/,Central NY,Central NY,Central NY,,reddit,Syracuse,23,38,3,,English,,1224,721
2026-05-21,r/Syracuse,public Reddit discussion,Sex allegations and free passes: Has Oswego had enough of notorious landlord Doug Waterbury?,Reddit discussion link: https://www.syracuse.com/news/2026/05/sex-allegations-and-free-passes-has-oswego-had-enough-of-notorious-landlord-doug-waterbury.html,https://www.reddit.com/r/Syracuse/comments/1tjrqen/sex_allegations_and_free_passes_has_oswego_had/,Central NY,Central NY,Central NY,housing / rent,reddit,Syracuse,92,42,2,landlord,English,,1224,721
2026-05-21,r/buffalo,public Reddit discussion,Buffalo Marathon Service!!!!,Reddit discussion link: https://i.redd.it/4hqn96l5nk2h1.jpeg,https://www.reddit.com/r/Buffalo/comments/1tk0xbd/buffalo_marathon_service/,Western NY,Western NY,Western NY,,reddit,buffalo,18,0,3,,English,,1224,721
2026-05-21,r/AskNYC,public Reddit discussion,How do you choose a good beauty salon/nail salon?,"First time getting a mani-pedi and I'm unsure where to go.

I know the local salons within walking distance that family and peers go to. There's a nail salon every other block around me. But, they either don't have an online prescence or they have mediocre Google reviews saying they're unhygenic or not ideal. Are reviews to be trusted, or are do most clients not leave reviews?

I've found some nail salons with better",https://www.reddit.com/r/AskNYC/comments/1tjtjg3/how_do_you_choose_a_good_beauty_salonnail_salon/,NYC,NYC,NYC,AI / tech jobs,reddit,AskNYC,1,11,3,"AI, trust",English,,1224,721
2026-05-21,r/buffalo,public Reddit discussion,Indie rock stations?,"Hi folks - we're moving from Pittsburgh to Buffalo soon, we hope. We really like WYEP, Pittsburgh's indie music station, and we're hoping Buffalo has something similar. Any suggestions?",https://www.reddit.com/r/Buffalo/comments/1tjr4ts/indie_rock_stations/,Western NY,Western NY,Western NY,,reddit,buffalo,7,24,2,,English,,1224,721
2026-05-21,r/buffalo,public Reddit discussion,Weekly development round up - 5.21.226,"[D'Youville, Shea's among Buffalo's biggest construction projects of 2026 - Buffalo Business First](https://www.bizjournals.com/buffalo/news/2026/05/21/top-five-new-construction-projects-buffalo-sheas.html?utm_source=st&amp;utm_medium=en&amp;utm_campaign=me&amp;utm_content=BU&amp;ana=e_BU_me&amp;j=45822269&amp;senddate=2026-05-21&amp;utm_term=ep4&amp;empos=p4)

**College of Osteopathic Medicine at D'Youville Universi",https://www.reddit.com/r/Buffalo/comments/1tjr0zz/weekly_development_round_up_521226/,Western NY,Western NY,Western NY,housing / rent,reddit,buffalo,18,7,3,"housing, AI",English,,1224,721
2026-05-21,r/buffalo,public Reddit discussion,Former Erie County narcotics chief charged with firearm storage violation after Niagara Square incident,"Former narcotics chief DJ Granville has now been given an appearance ticket for the misdemeanor charge of 1st degree Failure to Safely Store Firearms. The police report details how investigators found a backpack in the abandoned vehicle containing the loaded Glock pistol, as well as a badge, work ID, cell phone, and other items. WBEN reports in an article that the abandoned car is registered to Buffalo Biodiesel, the",https://www.reddit.com/r/Buffalo/comments/1tjoc3q/former_erie_county_narcotics_chief_charged_with/,Western NY,Western NY,Western NY,AI / tech jobs,reddit,buffalo,136,36,5,AI,English,,1224,721
2026-05-21,r/buffalo,public Reddit discussion,Reflecting on Ten Years of Gamelan in Buffalo - Buffalo Rising,"Article snippets:

""When I moved back to Buffalo from Central Java in 2013, I wasn’t sure what I was going to do with what I’d learned there. I’d spent two years on a Darmasiswa scholarship in the village of Karagan, in Solo, just outside the old royal Kraton palace, studying gamelan, the bronze and iron percussion ensembles that have been at the center of Javanese musical life for over a thousand years. I’d lived wi",https://www.reddit.com/r/Buffalo/comments/1tjlmwj/reflecting_on_ten_years_of_gamelan_in_buffalo/,Western NY,Western NY,Western NY,housing / rent,reddit,buffalo,26,2,5,rent,English,,1224,721
2026-05-21,r/buffalo,public Reddit discussion,Looking for Summer housing,"Hi all, I just got a last minute internship in downtown Buffalo that would run from June 15th to August 24th and I’m looking for apartments.

Does anyone know the best place to look to find housing? My office would be downtown and I’m on a kinda tight budget, hoping to not pay more than 900 but would definitely prefer lower (still gonna have to pay rent on my current apartment through August unfortunately)",https://www.reddit.com/r/Buffalo/comments/1tjl05q/looking_for_summer_housing/,Western NY,Western NY,Western NY,housing / rent,reddit,buffalo,4,9,4,"rent, housing",English,,1224,721
2026-05-21,r/buffalo,public Reddit discussion,Dishwasher Installation,Has anyone with an older home installed a dishwasher recently? Like no hookups at all currently. How much did it cost and who did you go with? I’ve gotten a quote from a company last year and they ghosted me. When i went to talk to someone at Home Depot they told me to just get a portable which I am not too big a fan of with the space i have.,https://www.reddit.com/r/Buffalo/comments/1tjiebj/dishwasher_installation/,Western NY,Western NY,Western NY,housing / rent,reddit,buffalo,2,16,2,rent,English,,1224,721
2026-05-21,r/buffalo,public Reddit discussion,Buffalo Police investigating whether gun found in abandoned car belongs to former narcotics chief DJ Granville,Reddit discussion link: https://www.wgrz.com/article/news/crime/buffalo-police-investigating-whether-gun-found-in-abandoned-car-belongs-to-ex-narcotics-chief-dj-granville/71-e3c789f6-6e67-435d-a596-d763e66bf8f7,https://www.reddit.com/r/Buffalo/comments/1tjgvq6/buffalo_police_investigating_whether_gun_found_in/,Western NY,Western NY,Western NY,,reddit,buffalo,93,21,3,,English,,1224,721
2026-05-21,r/buffalo,public Reddit discussion,What is social life like for young adults?,"Hey! I just got offered a summer internship in Buffalo that would start next month. 

I just spent the last year living in a small town in the midwest and it’s been pretty tough finding people my age that I can click with all while missing my friends/family back home on the east coast.

I’m not really sure if I want to take the job yet, and am kinda worried about having to spend a couple more months mostly by myself.",https://www.reddit.com/r/Buffalo/comments/1tj8nkj/what_is_social_life_like_for_young_adults/,Western NY,Western NY,Western NY,,reddit,buffalo,5,11,2,,English,,1224,721
2026-05-21,r/buffalo,public Reddit discussion,Resource for anyone in Buffalo whose antidepressants aren't doing enough,"Buffalo winters are long and if your meds aren't working on top of that it's brutal. If you've been through a few SSRIs and nothing's really sticking, [this page is worth a look](http://your-self-advocate.com/trd)

It's for people who already know what depression is and don't need another generic mental health page. Covers newer treatment options you can bring up with your psychiatrist and has coupons for some of the",https://www.reddit.com/r/Buffalo/comments/1tjw1z5/resource_for_anyone_in_buffalo_whose/,Western NY,Western NY,Western NY,,reddit,buffalo,6,13,4,,English,,1224,721
2026-05-21,r/buffalo,public Reddit discussion,Genesee County STAMP Data Center Information and Resources,Okay so I'm making this post because I'm just not going to allow a data center to be squeezed between the first people of the Tonawanda Reservation and the Iroquois National Wildlife Refuge without ATTEMPTING to wake our community up for what we've apparently signed up for as a state. I don't think \*anyone\* can point to a larger nature preserve in Western NY than Iroquois. If you are unaware of what an ecologically,https://www.reddit.com/r/Buffalo/comments/1tjxnh7/genesee_county_stamp_data_center_information_and/,Western NY,Western NY,Western NY,housing / rent,reddit,buffalo,96,18,3,"rent, AI",English,,1224,721
2026-05-21,r/buffalo,public Reddit discussion,any chemical / analog photo booths in buffalo?,any recommendations are appreciated!,https://www.reddit.com/r/Buffalo/comments/1tk1yg8/any_chemical_analog_photo_booths_in_buffalo/,Western NY,Western NY,Western NY,,reddit,buffalo,3,3,3,,English,,1224,721
2026-05-21,r/Syracuse,public Reddit discussion,Is PetSmart Training in Clay worth it?,"Hello, just wondering if anyone had any experience with PetSmart's training, especially the Clay location? I'm thinking about doing it with my dog (6yo rescue GS), but was hoping for some more specific reviews than I found on google.",https://www.reddit.com/r/Syracuse/comments/1tjq6ev/is_petsmart_training_in_clay_worth_it/,Central NY,Central NY,Central NY,AI / tech jobs,reddit,Syracuse,5,1,3,AI,English,,1224,721
2026-05-21,r/buffalo,public Reddit discussion,Coming Home: Christine Schonhart Appointed Director of Buffalo &amp; Erie County Public Library,New library director has been announced and it’s exciting news!,https://www.reddit.com/r/Buffalo/comments/1tk26bf/coming_home_christine_schonhart_appointed/,Western NY,Western NY,Western NY,,reddit,buffalo,19,4,3,,English,,1224,721
2026-05-21,r/Syracuse,public Reddit discussion,"Buying a car, and would like to know others experiences with dealerships at DV.",I have never purchased a vehicle from drivers village and would like to know what to expect. I plan on checking out the used car warehouse and the Burdick Toyota dealership. Anyone have a recent experience at either? Are they pushy/aggressive with their sales tactics? Do they allow you to haggle at all or are prices firm? Do they give you a hard time when it comes to financing? I would prefer to use my own financing ,https://www.reddit.com/r/Syracuse/comments/1tj7a49/buying_a_car_and_would_like_to_know_others/,Central NY,Central NY,Central NY,AI / tech jobs,reddit,Syracuse,4,12,2,AI,English,,1224,721
2026-05-21,r/Syracuse,public Reddit discussion,Salt Potatoes and Their Distinction,What about Syracuse style of salt potatoes make them unique or different from potatoes sprinkled salt all over? I say this as someone who grew up on the Northside in the 2010s and have yet to hear mention of them in-person before.,https://www.reddit.com/r/Syracuse/comments/1tj7jqj/salt_potatoes_and_their_distinction/,Central NY,Central NY,Central NY,housing / rent,reddit,Syracuse,12,44,3,rent,English,,1224,721
2026-05-21,r/Syracuse,public Reddit discussion,Allergist reccomendation please!,Doesn’t have to be in Syracuse or affiliated with the university but I’m looking to make an appointment with an allergist for chronic urticaria. Does anyone have any allergist recommendations they’ve had good experiences with?,https://www.reddit.com/r/Syracuse/comments/1tjdgrj/allergist_reccomendation_please/,Central NY,Central NY,Central NY,,reddit,Syracuse,4,2,2,,English,,1224,721
2026-05-21,r/Syracuse,public Reddit discussion,How to get a studio apt near Syracuse Uni?,"Hi everyone,

I’m an incoming grad student starting at Syracuse University this August, and honestly I’m kind of lost with the apartment search right now. This is my first time moving to Syracuse, so I don’t really know the area or where people actually find decent apartments.

I’ve mainly been using sites like [Apartments.com](http://Apartments.com) and Zillow looking for a studio apartment, but almost every place e",https://www.reddit.com/r/Syracuse/comments/1tjekc7/how_to_get_a_studio_apt_near_syracuse_uni/,Central NY,Central NY,Central NY,housing / rent,reddit,Syracuse,3,7,5,"housing, AI",English,,1224,721
2026-05-21,r/Syracuse,public Reddit discussion,"May 26 monthly Urbanism Collective meeting, open to public","The next monthly meeting of the Syracuse Urbanism Collective is on Tuesday, May 26, at 6pm at the Central Library at 447 S Salina St in Downtown. Bring your friends!

We'll have an interactive mapping activity to crowdsource safe biking routes. We've set up a platform to create, share, and download safe biking routes, at trails.syracuseurbanism.org. To get a larger critical mass of routes on this site, we'll bring in",https://www.reddit.com/r/Syracuse/comments/1tji0uu/may_26_monthly_urbanism_collective_meeting_open/,Central NY,Central NY,Central NY,AI / tech jobs,reddit,Syracuse,11,4,3,AI,English,,1224,721
