date,source_name,source_type,headline,snippet,url,geography,geography_refs,geography_matches,issue_area,source_platform,subreddit,score,num_comments,relevance_score,issue_keyword_matches,language,collection_failures,rows_before_filtering,rows_after_filtering
2026-05-24,r/nyc,public Reddit discussion,Mamdani pushed hard to boost NYC preschool enrollment. The numbers have yet to budge.,Reddit discussion link: https://www.chalkbeat.org/newyork/2026/05/19/nyc-preschool-offers-flat-mamdani-enrollment-push-3k/,https://www.reddit.com/r/nyc/comments/1tmp2rx/mamdani_pushed_hard_to_boost_nyc_preschool/,NYC,NYC,NYC,,reddit,nyc,116,54,3,,English,,1224,721
2026-05-24,r/nyc,public Reddit discussion,How the NYC Ferry Is Staging a Comeback — Bloomberg Television (YOUTUBE),Reddit discussion link: https://youtu.be/gYpuo6VOLck?si=1tmB5fsqUB1eJM2c,https://www.reddit.com/r/nyc/comments/1tmhb7y/how_the_nyc_ferry_is_staging_a_comeback_bloomberg/,NYC,NYC,NYC,,reddit,nyc,55,19,3,,English,,1224,721
2026-05-24,r/nyc,public Reddit discussion,Help me rehome this angel,"3 months old

I can drop her off in Brooklyn or Queens 

Please help. I cant take care of her. Anyone that can home a dog please contact me. No charge",https://www.reddit.com/r/nyc/comments/1tm8nbb/help_me_rehome_this_angel/,NYC,NYC,NYC,,reddit,nyc,89,33,2,,English,,1224,721
2026-05-24,r/nyc,public Reddit discussion,Israeli food boycott battle at Brooklyn food co-op exposes deepening NYC divisions,"&gt;A contentious proposal to boycott Israeli products at the Park Slope Food Coop is roiling a liberal Brooklyn community and exposing a deepening divide across NYC, even spilling into the NY-10th District congressional primary between Democrats Rep. Dan Goldman and challenger Brad Lander.

&gt;Members of the co-op are set to vote Tuesday on a heavily-debated proposal to ban all made-in-Israel items, with members st",https://www.reddit.com/r/nyc/comments/1tlxw7t/israeli_food_boycott_battle_at_brooklyn_food_coop/,NYC,NYC,NYC,AI / tech jobs,reddit,nyc,380,245,5,AI,English,,1224,721
2026-05-24,r/nyc,public Reddit discussion,"Twin boy, 6, who perished in Bronx fire, saves 3 people through organ donations",Reddit discussion link: https://www.nydailynews.com/2026/05/23/twin-boy-died-bronx-fire-saves-three-people-organ-donations/?share=2eot2eyposnowdisimn3,https://www.reddit.com/r/nyc/comments/1tlwluo/twin_boy_6_who_perished_in_bronx_fire_saves_3/,NYC,NYC,NYC,,reddit,nyc,234,16,3,,English,,1224,721
2026-05-23,r/Albany,public Reddit discussion,Savvy Sliders on Western Ave.?,"Does anybody know what's going on with the Savvy Sliders restaurant that's supposed to open on Western Ave. (in the building that used to be CoreLife Eatery, right by the Western Ave. entrance to UAlbany)? If I recall correctly, the signage for S.S. appeared sometime last Fall ... but I don't see anything about Albany in the ""upcoming locations"" on their website.",https://www.reddit.com/r/Albany/comments/1tlm0ed/savvy_sliders_on_western_ave/,Capital Region,Capital Region,Capital Region,,reddit,Albany,8,1,2,,English,,1224,721
2026-05-23,r/Albany,public Reddit discussion,Hello everyone is the fireside deli or fireside restaurant still there when I was in college union I used to go there a lot but that was 40 years ago. Just wondering also was Thelma Barfield from Schenectady?,"Hello everybody, do you know if the fireside deli is still there or fireside restaurant? I can’t remember the name.",https://www.reddit.com/r/Albany/comments/1tlqy34/hello_everyone_is_the_fireside_deli_or_fireside/,Capital Region,Capital Region,Capital Region,,reddit,Albany,0,7,3,,English,,1224,721
2026-05-23,r/Albany,public Reddit discussion,Best priced liquor in Albany?,"Sucker for spirits (vodka in particular) but open to anything, any really good prices on liquor and alcohol around Albany?",https://www.reddit.com/r/Albany/comments/1tlr0bg/best_priced_liquor_in_albany/,Capital Region,Capital Region,Capital Region,,reddit,Albany,1,12,4,,English,,1224,721
2026-05-23,r/Albany,public Reddit discussion,Shout out to Walmart Pharmacy in East Greenbush,"I hate to simp for Walmart (I know I'm gonna get hate for this lol) over a local pharmacy but I've used a lot of pharmacies in this area and this pharmacy is the nicest, fastest, most efficient, communicative, helpful and responsive pharmacy I've ever been to. Always have my ADHD meds in stock, pharmacy app and text message reminders are always on point. I don't think I've ever waited over 5 minutes to pick up and an",https://www.reddit.com/r/Albany/comments/1tlsz9v/shout_out_to_walmart_pharmacy_in_east_greenbush/,Capital Region,Capital Region,Capital Region,AI / tech jobs,reddit,Albany,26,5,2,AI,English,,1224,721
2026-05-23,r/longisland,public Reddit discussion,Catholic Mass without music,"Hi everyone, anyone know of any Catholic masses in the Massapequa area that doesn’t have any music?

I go to mass each week but don’t find the music to help my faith and makes the mass feel so much longer, so if anyone knows of any that’d be great!

I know Maria Regina in Seaford has one at 7:30 am on Sundays, but I’m a night owl so 7:30 am is tough.",https://www.reddit.com/r/longisland/comments/1tlq1l3/catholic_mass_without_music/,Long Island,Long Island,Long Island,AI / tech jobs,reddit,longisland,0,18,2,AI,English,,1224,721
2026-05-23,r/Syracuse,public Reddit discussion,"Artist studio rental spaces, besides The Gear Factory and Delevan?","I'm wondering if anyone knows of any spaces in the area where an artist can rent private space for a studio, that isn't the gear factory or Delevan. Nothing against the two, just wondering if there's any other spaces locally!",https://www.reddit.com/r/Syracuse/comments/1tlt5ku/artist_studio_rental_spaces_besides_the_gear/,Central NY,Central NY,Central NY,housing / rent,reddit,Syracuse,6,6,3,"rent, AI",English,,1224,721
2026-05-23,r/Syracuse,public Reddit discussion,Silent Disco tonight at Funk ’n Waffles in Syracuse — 3 DJs / 3 channels / one giant party - 5/23,"If you’re looking for something different to do in Syracuse tonight, Photo City Presents is bringing a full-on Silent Disco to Funk ’n Waffles.

Everyone gets wireless headphones with 3 live channels to switch between all night:

🎧 Best of the 80’s / 90’s  
🎧 Best of the 2000’s  
🎧 Late 2000’s – Today’s Hits

It’s always hilarious walking through the crowd hearing complete silence while watching 200 people scream dif",https://www.reddit.com/r/Syracuse/comments/1tlru7g/silent_disco_tonight_at_funk_n_waffles_in/,Central NY,Central NY,Central NY,housing / rent,reddit,Syracuse,8,0,5,rent,English,,1224,721
2026-05-23,r/Syracuse,public Reddit discussion,Is Brooso home a scam?,So im looking at apartments and saw one from a guy on zillow and the email he sent seemed a bit fishy. Does anyone have any experience with Brooso home?,https://www.reddit.com/r/Syracuse/comments/1tln008/is_brooso_home_a_scam/,Central NY,Central NY,Central NY,AI / tech jobs,reddit,Syracuse,5,2,2,AI,English,,1224,721
2026-05-23,r/Syracuse,public Reddit discussion,How do they transport animals to the aquarium?,Is there going to be a sea animal transportation day in Syracuse where they all come in big trucks filled with seawater? 🤯,https://www.reddit.com/r/Syracuse/comments/1tlkajx/how_do_they_transport_animals_to_the_aquarium/,Central NY,Central NY,Central NY,,reddit,Syracuse,16,19,2,,English,,1224,721
2026-05-23,r/Syracuse,public Reddit discussion,Anyone ever stayed at days inn Wyndham Liverpool? Debating about booking a night there for the state fair,Days Inn Liverpool,https://www.reddit.com/r/Syracuse/comments/1tlgcqy/anyone_ever_stayed_at_days_inn_wyndham_liverpool/,Central NY,Central NY,Central NY,AI / tech jobs,reddit,Syracuse,7,18,2,AI,English,,1224,721
2026-05-23,r/Syracuse,public Reddit discussion,The voice of SpongeBob helps launch new ‘Syracuse Challenger Park’ for adults and children with disabilities,Reddit discussion link: https://www.localsyr.com/news/local-news/tom-kenny-syracuse-baseball/?utm_medium=referral&amp;utm_source=nextdoor.com&amp;utm_campaign=nextdoor_news,https://www.reddit.com/r/Syracuse/comments/1tlg2q7/the_voice_of_spongebob_helps_launch_new_syracuse/,Central NY,Central NY,Central NY,,reddit,Syracuse,144,3,3,,English,,1224,721
2026-05-23,r/Syracuse,public Reddit discussion,Car insurance decision for my move to Syracuse,"I'm moving to Syracuse soon for a new healthcare job and buying a used 2023 car. I’m from Chicago and don’t drive so this is my first time getting a car. 

I’ve been looking around for insurance quotes and some companies are quoting me $500+ per month. The only way I could get it closer to $200 was by choosing very basic coverage through Progressive and Geico without comprehensive or collision coverage.

I wanted to ",https://www.reddit.com/r/Syracuse/comments/1tl8y71/car_insurance_decision_for_my_move_to_syracuse/,Central NY,Central NY,Central NY,,reddit,Syracuse,6,12,4,,English,,1224,721
2026-05-23,r/Syracuse,public Reddit discussion,Need Help Finding Doctors in Syracuse – Excellus BlueCross BlueShield Insurance,"Hello everyone.   
I live in Syracuse and I need help finding doctors who accept Excellus BlueCross BlueShield HMOBlue insurance  
If anyone can recommend good and understanding doctors in Syracuse who accept this insurance, I would really appreciate it.

Thank you so much to this wonderful group! 🙏",https://www.reddit.com/r/Syracuse/comments/1tl7lzr/need_help_finding_doctors_in_syracuse_excellus/,Central NY,Central NY,Central NY,,reddit,Syracuse,8,9,4,,English,,1224,721
2026-05-23,r/Syracuse,public Reddit discussion,Walking paths that aren't in the middle of the woods?,"Looking for walking paths that aren't necessarily hiking trails, such as the Erie canal.",https://www.reddit.com/r/Syracuse/comments/1tl3pm2/walking_paths_that_arent_in_the_middle_of_the/,Central NY,Central NY,Central NY,AI / tech jobs,reddit,Syracuse,9,22,2,AI,English,,1224,721
2026-05-23,r/Syracuse,public Reddit discussion,"""A Rock Sails By"" @ CNY Playhouse this weekend and the next at 7pm and one 2pm matinee","Tonight was the opening performance for ""A Rock Sails by"".

If you like themes of science and grief, and you enjoy a good play with a talented cast, this is for you. 

""Dr. Lynn Cummings, an astrophysicist, tries to bring science and faith into balance while grappling with personal questions, reconnecting with her daughter, and mourning the loss of her husband. When an unidentified object is discovered heading toward",https://www.reddit.com/r/Syracuse/comments/1tl2qdq/a_rock_sails_by_cny_playhouse_this_weekend_and/,Central NY,Central NY,Central NY,AI / tech jobs,reddit,Syracuse,2,0,3,AI,English,,1224,721
2026-05-23,r/politics,public Reddit discussion,"NYC Mayor Zohran Mamdani releases audit accusing federal immigration agents of misleading tactics | DHS personnel falsely identified themselves as Fire Department officials at a shelter in June 2025, the report states",Reddit discussion link: https://www.foxnews.com/politics/nyc-mayor-zohran-mamdani-releases-audit-accusing-federal-immigration-agents-misleading-tactics,https://www.reddit.com/r/politics/comments/1tl99ld/nyc_mayor_zohran_mamdani_releases_audit_accusing/,NYC,NYC,NYC,immigration / public safety,reddit,politics,2759,19,3,immigration,English,,1224,721
2026-05-23,r/Syracuse,public Reddit discussion,Technical Sales Job Opportunity - American Steel and Aluminum Liverpool $70k-$90k,"Good evening r/Syracuse!

Our factory has an opening on the sales team I'm trying to help fill, if it sounds like a fit for you please apply!

I'm going to drop a bit of background info I think is useful and I'll drop the full ad at the end.

A bit of background on our facility, until recently ASA was a raw material service center. In the past few years we've made the transition to a fabrication shop. I've been here ",https://www.reddit.com/r/Syracuse/comments/1tl0do6/technical_sales_job_opportunity_american_steel/,Central NY,Central NY,Central NY,housing / rent,reddit,Syracuse,27,0,3,"rent, AI, trust",English,,1224,721
2026-05-23,r/AskNYC,public Reddit discussion,Are The Women Who Sell Candy On The Train A New Thing?,"Ok, so I was out with friends a few days ago and all but one of us is a transplant who moved here within the last 4 years. We were talking about the women who sell candy on the train and our friend who’s born and raised in Queens, but is also pretty oblivious sometimes, told us that people selling candy on the trains only started happening in 2022.  
The rest of us were kind of suspicious that it’s something that wou",https://www.reddit.com/r/AskNYC/comments/1tlq8it/are_the_women_who_sell_candy_on_the_train_a_new/,NYC,NYC,NYC,AI / tech jobs,reddit,AskNYC,0,37,4,AI,English,,1224,721
2026-05-23,r/AskNYC,public Reddit discussion,The Stand NYC,Does anyone know how strict The Stand would be for ages and do they check ids. I have a group of 20 year olds who wanna go.,https://www.reddit.com/r/AskNYC/comments/1tlqw4z/the_stand_nyc/,NYC,NYC,NYC,,reddit,AskNYC,4,18,3,,English,,1224,721
2026-05-23,r/AskNYC,public Reddit discussion,Grand Jury duty - college student,"College student who resides in NYC but attends school out of state received a Grand Jury summons and postponed because he got called during the school year. The second summons came and it is during the college student’s summer internship which does not permit the student any days off. The college student cannot serve grand jury duty, second postponements are not permitted. Is it possible for the college student to ge",https://www.reddit.com/r/AskNYC/comments/1tlrvma/grand_jury_duty_college_student/,NYC,NYC,NYC,,reddit,AskNYC,5,18,2,,English,,1224,721
2026-05-23,r/AskNYC,public Reddit discussion,ISO New York archival footage pre &amp; post 9/11,"Hello everyone,

I’m currently developing a short archival documentary and am searching for personal or lesser-seen footage of New York City from before 9/11, during the day itself, and the weeks/months afterward. I’m especially interested in material that captures everyday life, atmosphere, texture, people, neighborhoods, routines, street scenes, conversations, commutes, storefronts, apartments, etc. 

Pre-9/11 foot",https://www.reddit.com/r/AskNYC/comments/1tlukq4/iso_new_york_archival_footage_pre_post_911/,NYC,NYC,NYC,housing / rent,reddit,AskNYC,1,0,5,rent,English,,1224,721
2026-05-23,r/Syracuse,public Reddit discussion,Syracuse Chargers rugby team wins first national title: ‘Congratulations. Are you actually OK?’,Reddit discussion link: https://www.syracuse.com/sports/2026/05/syracuse-chargers-rugby-team-wins-first-national-title-congratulations-are-you-actually-ok.html,https://www.reddit.com/r/Syracuse/comments/1tl21rb/syracuse_chargers_rugby_team_wins_first_national/,Central NY,Central NY,Central NY,,reddit,Syracuse,38,3,3,,English,,1224,721
2026-05-23,r/newyork,public Reddit discussion,Blast at New York City shipyard injures at least 16,Reddit discussion link: https://www.kwtx.com/video/2026/05/23/blast-new-york-city-shipyard-injures-least-16/,https://www.reddit.com/r/newyork/comments/1tl0tal/blast_at_new_york_city_shipyard_injures_at_least/,NYC,NYC,NYC,,reddit,newyork,26,1,3,,English,,1224,721
2026-05-23,r/Syracuse,public Reddit discussion,When to arrive at airport?,I’ve got a flight this coming week departing at about 6am. When would you recommend I get to the airport?,https://www.reddit.com/r/Syracuse/comments/1tlthyx/when_to_arrive_at_airport/,Central NY,Central NY,Central NY,AI / tech jobs,reddit,Syracuse,5,15,3,AI,English,,1224,721
2026-05-23,r/Rochester,public Reddit discussion,Do young people even care?,"I stopped by the ice detainment center protest earlier today.... there were a few senior citizens, and not a single young person to be seen. 

  
Where are the young people? Do they even care about the abuse of power happening right now? Looking to hear from 20 and 30 somethings here... what would it take to shake the apparent widespread apathy and get engaged? 

Would indoor meet ups be better?

Given the apathy on ",https://www.reddit.com/r/Rochester/comments/1tlobpj/do_young_people_even_care/,Western NY,Western NY,Western NY,housing / rent,reddit,Rochester,0,41,2,"rent, AI",English,,1224,721
2026-05-23,r/Rochester,public Reddit discussion,HELP TRUCK STRIKES AGAIN,Reddit discussion link: https://i.redd.it/47acaul4ey2h1.jpeg,https://www.reddit.com/r/Rochester/comments/1tlsm3c/help_truck_strikes_again/,Western NY,Western NY,Western NY,AI / tech jobs,reddit,Rochester,0,0,2,AI,English,,1224,721
2026-05-23,r/Rochester,public Reddit discussion,Local advocate or RAINN type orgs for a deaf person in need?,"It’s so hard to ask this. I’ve been avoiding it, but I don’t think I can anymore. 

Some background: I’m a Deaf queer person (she/he) in my thirties experiencing possible financial abuse and/or isolation alongside emotional abuse by my family (who live out of state) for years now. I currently live alone. 

It is a complex situation and I would love to know what resources to contact to hopefully defuse the situation, ",https://www.reddit.com/r/Rochester/comments/1tlrr2o/local_advocate_or_rainn_type_orgs_for_a_deaf/,Western NY,Western NY,Western NY,housing / rent,reddit,Rochester,21,3,3,"rent, AI",English,,1224,721
2026-05-23,r/Rochester,public Reddit discussion,Apartments downtown,"Currently not living down town but I know rochester really well. Was thinking about maybe moving to 88 on Elm, to walk to work. Anyone there? How is it? Im not super picky I use to live on Ave D. So I can handle most things lol 

Opinions on other downtown apartments would be appreciated also!!",https://www.reddit.com/r/Rochester/comments/1tlrcbi/apartments_downtown/,Western NY,Western NY,Western NY,housing / rent,reddit,Rochester,10,11,3,rent,English,,1224,721
2026-05-23,r/Rochester,public Reddit discussion,We need to build more housing especially multi family,"Rochester Metro area like many northeast cities has a backwards approach to building new homes when it comes to lowering rent and increasing the attractiveness of our city for homeowners. We need to both build more homes and loosen zoning laws to allow more multifamily homes.   And that means changing zoning laws somewhat in the city but especially in the burbs. 

 https://www.nytimes.com/interactive/2026/05/18/opini",https://www.reddit.com/r/Rochester/comments/1tlqq9h/we_need_to_build_more_housing_especially_multi/,Western NY,Western NY,Western NY,housing / rent,reddit,Rochester,31,32,4,"rent, housing",English,,1224,721
2026-05-23,r/Rochester,public Reddit discussion,Penfield Village Apartment Homes Question,"I am looking for apartments in Fairport area. If you live in the 2 bedroom apartments, do you have in unit laundry or a hookup for laundry? I have been completely unable to get ahold of a human and the AI ""assistant"" I contacted gave me contradictory answers.",https://www.reddit.com/r/Rochester/comments/1tlpo77/penfield_village_apartment_homes_question/,Western NY,Western NY,Western NY,AI / tech jobs,reddit,Rochester,0,2,2,AI,English,,1224,721
2026-05-23,r/Rochester,public Reddit discussion,Is mamasans still ever going to open?,"Ive been checking their website about once every month now for almost a year and it’s been one month from opening the whole time😭 now it’s just fun to check, it’s like waiting for the jwst.",https://www.reddit.com/r/Rochester/comments/1tlp8w6/is_mamasans_still_ever_going_to_open/,Western NY,Western NY,Western NY,AI / tech jobs,reddit,Rochester,9,5,2,AI,English,,1224,721
2026-05-23,r/Rochester,public Reddit discussion,Places to Swim in Webster,Work trip to Webster and am looking for a place to swim. Would love the opportunity to swim in Lake Ontario but I'm seeing different opinions of whether people think it's safe to. It would just be a dunk rather than spending a lot of time in the water. Any beaches in Webster?,https://www.reddit.com/r/Rochester/comments/1tlozi4/places_to_swim_in_webster/,Western NY,Western NY,Western NY,housing / rent,reddit,Rochester,10,20,2,rent,English,,1224,721
2026-05-23,r/Rochester,public Reddit discussion,Need some nerdy friends,"I moved to Greece a little over a year ago I got a divorce from Buffalo and I don't really know anyone out here. I am ready to get back out there, make some friends, and find joy in life again. anyone have recommendations on meeting channels or discords?",https://www.reddit.com/r/Rochester/comments/1tlo9id/need_some_nerdy_friends/,Western NY,Western NY,Western NY,AI / tech jobs,reddit,Rochester,17,17,3,AI,English,,1224,721
2026-05-23,r/Rochester,public Reddit discussion,TINTED HELP TRUCK STRIKES AGAIN,Reddit discussion link: https://i.redd.it/0jg074e0gy2h1.jpeg,https://www.reddit.com/r/Rochester/comments/1tlspm1/tinted_help_truck_strikes_again/,Western NY,Western NY,Western NY,AI / tech jobs,reddit,Rochester,0,2,2,AI,English,,1224,721
2026-05-23,r/Rochester,public Reddit discussion,Tom Segura recommends Redd in Rochester out of any restaurant in the US,Reddit discussion link: https://youtube.com/shorts/Msqk8gx1C1I?si=kCciCXGHIEqm4lxL,https://www.reddit.com/r/Rochester/comments/1tllpdn/tom_segura_recommends_redd_in_rochester_out_of/,Western NY,Western NY,Western NY,,reddit,Rochester,225,38,3,,English,,1224,721
2026-05-23,r/Rochester,public Reddit discussion,Star Trek Action Figures,"I know we have some collectors in Rochester. Had these delivered to the shop last week by one of my consignors. Current selection includes mostly TNG series, and a few from DS9, Marvel, and WWE. If you have any specifics you’re looking for, feel free to reach out and I’ll let you know if I have it.",https://www.reddit.com/r/Rochester/comments/1tljcc6/star_trek_action_figures/,Western NY,Western NY,Western NY,housing / rent,reddit,Rochester,2,3,3,rent,English,,1224,721
2026-05-23,r/Rochester,public Reddit discussion,Your Kid Met My Kid at Goodwill and Now I’m Apparently Networking,"I was shopping with my kiddo at Goodwill when another kiddo ran up and they squeeed over their hair and invader zim outfits.

Afterwards mine mentioned they should have traded numbers so here I am. If that was your kiddo, hit me up lol.

Edited to add: Webster Goodwill",https://www.reddit.com/r/Rochester/comments/1tlj2xb/your_kid_met_my_kid_at_goodwill_and_now_im/,Western NY,Western NY,Western NY,housing / rent,reddit,Rochester,145,16,3,"rent, AI",English,,1224,721
2026-05-23,r/Rochester,public Reddit discussion,Tell me why I should or should not get a Costco membership!,"I have a husband &amp; 2 boys ages 8 &amp; 9 who eat like beasts.  We had a BJ's membership, but let it run out about a year or so ago.  We've been thinking about getting a Costco membership.

I currently shop mostly at Aldi, but want more variety with groceries &amp; meat.  I live in Greece, so it would be a a bit of a drive... and I hear it's always a madhouse there.  I would probably use the delivery once in a whi",https://www.reddit.com/r/Rochester/comments/1tlhnjv/tell_me_why_i_should_or_should_not_get_a_costco/,Western NY,Western NY,Western NY,housing / rent,reddit,Rochester,33,127,2,rent,English,,1224,721
2026-05-23,r/Rochester,public Reddit discussion,Landlord renovations left our house a mess. What can we do?,"We are ending our lease this summer and our landlord has been trying to rent our apartment with no luck (probably because he’s raising the rent by $600 a month). He recently asked us if we would be out of town at all so he could do a couple renovations. We were away two days this week and said he could come then.

He painted the bathroom and refinished the wood floor in our entry way. When we got home Friday our hous",https://www.reddit.com/r/Rochester/comments/1tlgr2f/landlord_renovations_left_our_house_a_mess_what/,Western NY,Western NY,Western NY,housing / rent,reddit,Rochester,16,9,3,"rent, landlord, AI",English,,1224,721
2026-05-23,r/Rochester,public Reddit discussion,2 bedroom Apartment/Townhouse,"Hey, I’m looking for a 2 bedroom apartment or townhouse. The amount of bathrooms don’t matter. But I need a in unit washer/dryer and Heat included. My max rent is $1700. I’m in Rochester but I don’t mind going slightly out of the city. I’ve been looking for months and I have no luck. Any help is appreciated. Thanks!",https://www.reddit.com/r/Rochester/comments/1tl40dy/2_bedroom_apartmenttownhouse/,Western NY,Western NY,Western NY,housing / rent,reddit,Rochester,4,7,3,rent,English,,1224,721
2026-05-23,r/AskNYC,public Reddit discussion,Looking for a Danza Azteca group 5/23,"Hello, I’m looking for a Danza Azteca group that would be willing to perform at our dear friend Roy Martinez vigil tomorrow in Jackson Heights Queens.  Roy was a champion for Mexican culture in New York, and was loved by many.",https://www.reddit.com/r/AskNYC/comments/1tl27hs/looking_for_a_danza_azteca_group_523/,NYC,NYC,NYC,,reddit,AskNYC,3,1,2,,English,,1224,721
2026-05-23,r/Rochester,public Reddit discussion,RocPokéCon is 3 weeks from today! AMA,"Hello! I am one of the local organizers of RocPokéCon. Our team will be returning this June at a new venue with over 100 of our vendor friends to bring you unique access to thousands of Pokémon cards and products spanning several generations of the TCG. Many of our vendors also carry other popular TCGs, such as One Piece and Magic: The Gathering. New to this show will be a VIP experience including a breakfast buffet ",https://www.reddit.com/r/Rochester/comments/1tlsm8e/rocpokécon_is_3_weeks_from_today_ama/,Western NY,Western NY,Western NY,AI / tech jobs,reddit,Rochester,4,2,2,AI,English,,1224,721
